5103,"Kab. Badung, Bali",Kab,SMP,463,224,24,11,722, 64.1 , 31.0 , 3.3 , 1.5 ,528.77,11.82,13.4
5106,"Kab. Bangli, Bali",Kab,SMP,208,179,17,4,408, 51.0 , 43.9 , 4.2 , 1.0 ,393.96,12.5,18.7
5108,"Kab. Buleleng, Bali",Kab,SMP,336,489,54,54,933, 36.0 , 52.4 , 5.8 , 5.8 ,468.65,11.96,22.8
5104,"Kab. Gianyar, Bali",Kab,SMP,193,370,16,3,582, 33.2 , 63.6 , 2.7 , 0.5 ,513.67,12.82,13.9
5101,"Kab. Jembrana, Bali",Kab,SMP,191,160,11,24,386, 49.5 , 41.5 , 2.8 , 6.2 ,464.12,14.38,14.8
5107,"Kab. Karang Asem, Bali",Kab,SMP,292,223,27,17,559, 52.2 , 39.9 , 4.8 , 3.0 ,426.96,11.4,23.9
5105,"Kab. Klungkung, Bali",Kab,SMP,92,153,25,14,284, 32.4 , 53.9 , 8.8 , 4.9 ,411.43,11.52,14.3
5102,"Kab. Tabanan, Bali",Kab,SMP,253,306,14,26,599, 42.2 , 51.1 , 2.3 , 4.3 ,483.79,13.21,21.8
5171,"Kota Denpasar, Bali",Kota,SMP,591,292,14,20,917, 64.4 , 31.8 , 1.5 , 2.2 ,628.98,13.6,13.8
1901,"Kab. Bangka, Bangka Belitung",Kab,SMP,202,232,11,12,457, 44.2 , 50.8 , 2.4 , 2.6 ,293.07,9.44,14.6
1903,"Kab. Bangka Barat, Bangka Belitung",Kab,SMP,130,181,1,6,318, 40.9 , 56.9 , 0.3 , 1.9 ,238.41,8.59,16.1
1905,"Kab. Bangka Selatan, Bangka Belitung",Kab,SMP,137,118,20,27,302, 45.4 , 39.1 , 6.6 , 8.9 ,262.6,8.43,18.3
1904,"Kab. Bangka Tengah, Bangka Belitung",Kab,SMP,91,133,9,11,244, 37.3 , 54.5 , 3.7 , 4.5 ,311.23,9.18,16.1
1902,"Kab. Belitung, Bangka Belitung",Kab,SMP,88,136,18,20,262, 33.6 , 51.9 , 6.9 , 7.6 ,305.88,8.73,14.7
1906,"Kab. Belitung Timur, Bangka Belitung",Kab,SMP,117,86,2,4,209, 56.0 , 41.1 , 1.0 , 1.9 ,237.32,9.32,14.5
1971,"Kota Pangkalpinang, Bangka Belitung",Kota,SMP,153,107,15,25,300, 51.0 , 35.7 , 5.0 , 8.3 ,392.13,10.63,12.4
3602,"Kab. Lebak, Banten",Kab,SMP,680,711,161,220,1772, 38.4 , 40.1 , 9.1 , 12.4 ,255.48,6.85,13.9
3601,"Kab. Pandeglang, Banten",Kab,SMP,492,796,97,156,1541, 31.9 , 51.7 , 6.3 , 10.1 ,317.64,9.12,14.9
3604,"Kab. Serang, Banten",Kab,SMP,339,1133,164,169,1805, 18.8 , 62.8 , 9.1 , 9.4 ,285.25,8.01,16.6
3603,"Kab. Tangerang, Banten",Kab,SMP,1315,1811,161,184,3471, 37.9 , 52.2 , 4.6 , 5.3 ,337.12,8.25,15.8
3672,"Kota Cilegon, Banten",Kota,SMP,122,286,44,50,502, 24.3 , 57.0 , 8.8 , 10.0 ,351.12,11.12,0.4
3673,"Kota Serang, Banten",Kota,SMP,261,520,39,28,848, 30.8 , 61.3 , 4.6 , 3.3 ,383.47,10.6,22
3671,"Kota Tangerang, Banten",Kota,SMP,997,894,89,50,2030, 49.1 , 44.0 , 4.4 , 2.5 ,370.2,10.15,20.2
3674,"Kota Tangerang Selatan, Banten",Kota,SMP,946,731,45,44,1766, 53.6 , 41.4 , 2.5 , 2.5 ,316.91,10.09,14.8
1701,"Kab. Bengkulu Selatan, Bengkulu",Kab,SMP,92,177,43,66,378, 24.3 , 46.8 , 11.4 , 17.5 ,231.47,9.14,13.6
1709,"Kab. Bengkulu Tengah, Bengkulu",Kab,SMP,31,148,27,13,219, 14.2 , 67.6 , 12.3 , 5.9 ,158.69,6.63,11.5
1703,"Kab. Bengkulu Utara, Bengkulu",Kab,SMP,107,255,83,92,537, 19.9 , 47.5 , 15.5 , 17.1 ,181,6.9,9.8
1704,"Kab. Kaur, Bengkulu",Kab,SMP,61,167,15,27,270, 22.6 , 61.9 , 5.6 , 10.0 ,144.59,5.51,12
1708,"Kab. Kepahiang, Bengkulu",Kab,SMP,24,141,43,36,244, 9.8 , 57.8 , 17.6 , 14.8 ,193.61,7.82,11.8
1707,"Kab. Lebong, Bengkulu",Kab,SMP,48,80,17,51,196, 24.5 , 40.8 , 8.7 , 26.0 ,213.92,8.54,10.9
1706,"Kab. Muko-muko, Bengkulu",Kab,SMP,80,198,42,42,362, 22.1 , 54.7 , 11.6 , 11.6 ,160.48,7.2,10.5
1702,"Kab. Rejang Lebong, Bengkulu",Kab,SMP,76,293,59,84,512, 14.8 , 57.2 , 11.5 , 16.4 ,233.74,7.46,11.3
1705,"Kab. Seluma, Bengkulu",Kab,SMP,63,178,63,58,362, 17.4 , 49.2 , 17.4 , 16.0 ,183.94,6.19,10.1
1771,"Kota Bengkulu, Bengkulu",Kota,SMP,53,346,77,92,568, 9.3 , 60.9 , 13.6 , 16.2 ,412.66,14.1,13.7
3402,"Kab. Bantul, D.I. Yogyakarta",Kab,SMP,375,681,42,39,1137, 33.0 , 59.9 , 3.7 , 3.4 ,350.51,12.39,16.6
3403,"Kab. Gunung Kidul, D.I. Yogyakarta",Kab,SMP,355,515,61,49,980, 36.2 , 52.6 , 6.2 , 5.0 ,222.86,8.36,18
3401,"Kab. Kulon Progo, D.I. Yogyakarta",Kab,SMP,176,418,12,14,620, 28.4 , 67.4 , 1.9 , 2.3 ,235.92,9.17,13
3404,"Kab. Sleman, D.I. Yogyakarta",Kab,SMP,394,844,32,35,1305, 30.2 , 64.7 , 2.5 , 2.7 ,334.53,11.14,12.2
3471,"Kota Yogyakarta, D.I. Yogyakarta",Kota,SMP,374,382,4,0,760, 49.2 , 50.3 , 0.5 , -   ,386.6,12.9,19.6
3174,"Kota Jakarta Barat, D.K.I. Jakarta",Kota,SMP,1678,868,48,85,2679, 62.6 , 32.4 , 1.8 , 3.2 ,286.71,8.74,
3173,"Kota Jakarta Pusat, D.K.I. Jakarta",Kota,SMP,627,553,54,50,1284, 48.8 , 43.1 , 4.2 , 3.9 ,349.62,10.84,
3171,"Kota Jakarta Selatan, D.K.I. Jakarta",Kota,SMP,1557,904,81,76,2618, 59.5 , 34.5 , 3.1 , 2.9 ,384.13,11.87,
3172,"Kota Jakarta Timur, D.K.I. Jakarta",Kota,SMP,1841,1235,65,125,3266, 56.4 , 37.8 , 2.0 , 3.8 ,418,10.85,
3175,"Kota Jakarta Utara, D.K.I. Jakarta",Kota,SMP,982,760,45,36,1823, 53.9 , 41.7 , 2.5 , 2.0 ,309.74,8.82,
7501,"Kab. Boalemo, Gorontalo",Kab,SMP,86,152,44,29,311, 27.7 , 48.9 , 14.1 , 9.3 ,118.75,5.33,12.2
7504,"Kab. Bone Bolango, Gorontalo",Kab,SMP,113,104,37,12,266, 42.5 , 39.1 , 13.9 , 4.5 ,187.03,6.79,15.4
7502,"Kab. Gorontalo, Gorontalo",Kab,SMP,207,427,38,62,734, 28.2 , 58.2 , 5.2 , 8.4 ,129.08,5.3,13.8
7505,"Kab. Gorontalo Utara, Gorontalo",Kab,SMP,88,153,8,6,255, 34.5 , 60.0 , 3.1 , 2.4 ,120.43,5.41,10.7
7503,"Kab. Pohuwato, Gorontalo",Kab,SMP,91,141,13,14,259, 35.1 , 54.4 , 5.0 , 5.4 ,139.55,6.2,12.7
7502,"Kota Gorontalo, Gorontalo",Kota,SMP,164,112,1,39,316, 51.9 , 35.4 , 0.3 , 12.3 ,129.08,5.3,13.8
1504,"Kab. Batang Hari, Jambi",Kab,SMP,73,275,26,34,408, 17.9 , 67.4 , 6.4 , 8.3 ,179.5,6.42,11.9
1509,"Kab. Bungo, Jambi",Kab,SMP,136,295,26,49,506, 26.9 , 58.3 , 5.1 , 9.7 ,211.17,7.7,16.2
1501,"Kab. Kerinci, Jambi",Kab,SMP,91,231,49,69,440, 20.7 , 52.5 , 11.1 , 15.7 ,150.35,6.9,14.5
1502,"Kab. Merangin, Jambi",Kab,SMP,45,428,65,43,581, 7.7 , 73.7 , 11.2 , 7.4 ,145.86,5.61,12.1
1505,"Kab. Muaro Jambi, Jambi",Kab,SMP,167,316,62,39,584, 28.6 , 54.1 , 10.6 , 6.7 ,178.03,6.89,11.9
1503,"Kab. Sarolangun, Jambi",Kab,SMP,103,239,52,58,452, 22.8 , 52.9 , 11.5 , 12.8 ,150.42,5.46,18.7
1507,"Kab. Tanjung Jabung Barat, Jambi",Kab,SMP,76,250,50,23,399, 19.0 , 62.7 , 12.5 , 5.8 ,166.25,6.1,15.7
1506,"Kab. Tanjung Jabung Timur, Jambi",Kab,SMP,74,169,30,67,340, 21.8 , 49.7 , 8.8 , 19.7 ,159.02,5.84,17.1
1508,"Kab. Tebo, Jambi",Kab,SMP,54,315,50,40,459, 11.8 , 68.6 , 10.9 , 8.7 ,186.72,6.9,15.4
1571,"Kota Jambi, Jambi",Kota,SMP,293,453,83,69,898, 32.6 , 50.4 , 9.2 , 7.7 ,408.98,11.65,19.5
1572,"Kota Sungai Penuh, Jambi",Kota,SMP,15,110,43,42,210, 7.1 , 52.4 , 20.5 , 20.0 ,338.54,11.69,17.8
3204,"Kab. Bandung, Jawa Barat",Kab,SMP,951,2023,341,287,3602, 26.4 , 56.2 , 9.5 , 8.0 ,471.75,10.73,18.1
3217,"Kab. Bandung Barat, Jawa Barat",Kab,SMP,399,952,184,225,1760, 22.7 , 54.1 , 10.5 , 12.8 ,422.78,10.48,18.7
3216,"Kab. Bekasi, Jawa Barat",Kab,SMP,976,1872,177,253,3278, 29.8 , 57.1 , 5.4 , 7.7 ,391.17,8.55,19.9
3201,"Kab. Bogor, Jawa Barat",Kab,SMP,2244,3133,308,304,5989, 37.5 , 52.3 , 5.1 , 5.1 ,331.34,7.89,15.1
3207,"Kab. Ciamis, Jawa Barat",Kab,SMP,339,690,173,95,1297, 26.1 , 53.2 , 13.3 , 7.3 ,375.09,10.7,14.1
3203,"Kab. Cianjur, Jawa Barat",Kab,SMP,661,1646,241,343,2891, 22.9 , 56.9 , 8.3 , 11.9 ,393.98,8.96,23
3209,"Kab. Cirebon, Jawa Barat",Kab,SMP,514,1433,187,329,2463, 20.9 , 58.2 , 7.6 , 13.4 ,448.91,11.45,14.5
3205,"Kab. Garut, Jawa Barat",Kab,SMP,596,2197,337,235,3365, 17.7 , 65.3 , 10.0 , 7.0 ,314.2,8.8,14.1
3212,"Kab. Indramayu, Jawa Barat",Kab,SMP,451,1095,270,246,2062, 21.9 , 53.1 , 13.1 , 11.9 ,340.96,9.79,11.9
3215,"Kab. Karawang, Jawa Barat",Kab,SMP,424,1359,293,291,2367, 17.9 , 57.4 , 12.4 , 12.3 ,627.6,14.28,13.9
3208,"Kab. Kuningan, Jawa Barat",Kab,SMP,331,674,187,217,1409, 23.5 , 47.8 , 13.3 , 15.4 ,437.65,12.57,20.1
3210,"Kab. Majalengka, Jawa Barat",Kab,SMP,770,428,140,98,1436, 53.6 , 29.8 , 9.7 , 6.8 ,394.53,12.25,13.5
3218,"Kab. Pangandaran, Jawa Barat",Kab,SMP,116,247,68,69,500, 23.2 , 49.4 , 13.6 , 13.8 ,292.3,9.13,19.9
3214,"Kab. Purwakarta, Jawa Barat",Kab,SMP,397,690,64,117,1268, 31.3 , 54.4 , 5.0 , 9.2 ,239.19,6.38,15.1
3213,"Kab. Subang, Jawa Barat",Kab,SMP,416,961,223,313,1913, 21.7 , 50.2 , 11.7 , 16.4 ,432.69,10.1,0.7
3202,"Kab. Sukabumi, Jawa Barat",Kab,SMP,651,1551,307,298,2807, 23.2 , 55.3 , 10.9 , 10.6 ,288.76,7.82,13.1
3211,"Kab. Sumedang, Jawa Barat",Kab,SMP,254,977,166,124,1521, 16.7 , 64.2 , 10.9 , 8.2 ,459.51,13.87,15.1
3206,"Kab. Tasikmalaya, Jawa Barat",Kab,SMP,689,1196,173,174,2232, 30.9 , 53.6 , 7.8 , 7.8 ,270.62,8.56,19.9
3273,"Kota Bandung, Jawa Barat",Kota,SMP,1157,1811,133,98,3199, 36.2 , 56.6 , 4.2 , 3.1 ,493.52,12.87,12
6303,"Kota Banjar, Jawa Barat",Kota,SMP,78,131,37,49,295, 26.4 , 44.4 , 12.5 , 16.6 ,383.33,12.43,14.7
3275,"Kota Bekasi, Jawa Barat",Kota,SMP,1203,1464,87,70,2824, 42.6 , 51.8 , 3.1 , 2.5 ,391.12,9.76,20.7
3271,"Kota Bogor, Jawa Barat",Kota,SMP,663,716,50,16,1445, 45.9 , 49.6 , 3.5 , 1.1 ,393.7,10.78,14.3
3277,"Kota Cimahi, Jawa Barat",Kota,SMP,312,249,19,8,588, 53.1 , 42.3 , 3.2 , 1.4 ,629,14.25,11.4
3274,"Kota Cirebon, Jawa Barat",Kota,SMP,129,466,20,15,630, 20.5 , 74.0 , 3.2 , 2.4 ,474.02,13.9,12.8
3276,"Kota Depok, Jawa Barat",Kota,SMP,817,988,47,94,1946, 42.0 , 50.8 , 2.4 , 4.8 ,318.62,8.4,16.9
3272,"Kota Sukabumi, Jawa Barat",Kota,SMP,145,325,14,27,511, 28.4 , 63.6 , 2.7 , 5.3 ,403.43,11.88,11.2
3278,"Kota Tasikmalaya, Jawa Barat",Kota,SMP,383,476,31,54,944, 40.6 , 50.4 , 3.3 , 5.7 ,437.34,13.51,
3304,"Kab. Banjarnegara, Jawa Tengah",Kab,SMP,407,682,24,29,1142, 35.6 , 59.7 , 2.1 , 2.5 ,323.4,10.83,19.2
3302,"Kab. Banyumas, Jawa Tengah",Kab,SMP,661,1103,135,206,2105, 31.4 , 52.4 , 6.4 , 9.8 ,421.41,11.78,22.4
3325,"Kab. Batang, Jawa Tengah",Kab,SMP,184,530,52,39,805, 22.9 , 65.8 , 6.5 , 4.8 ,370.32,11.4,13.9
3316,"Kab. Blora, Jawa Tengah",Kab,SMP,200,762,60,66,1088, 18.4 , 70.0 , 5.5 , 6.1 ,349.93,10.81,11.6
3309,"Kab. Boyolali, Jawa Tengah",Kab,SMP,330,705,82,74,1191, 27.7 , 59.2 , 6.9 , 6.2 ,374.19,12.62,15.7
3329,"Kab. Brebes, Jawa Tengah",Kab,SMP,459,1105,123,101,1788, 25.7 , 61.8 , 6.9 , 5.6 ,412.99,10.9,15.9
3301,"Kab. Cilacap, Jawa Tengah",Kab,SMP,439,1459,287,201,2386, 18.4 , 61.1 , 12.0 , 8.4 ,357.9,10.27,14.5
3321,"Kab. Demak, Jawa Tengah",Kab,SMP,191,508,124,94,917, 20.8 , 55.4 , 13.5 , 10.3 ,309.29,9.71,15
3315,"Kab. Grobogan, Jawa Tengah",Kab,SMP,356,929,121,151,1557, 22.9 , 59.7 , 7.8 , 9.7 ,329.91,9.69,14.6
3320,"Kab. Jepara, Jawa Tengah",Kab,SMP,381,494,47,26,948, 40.2 , 52.1 , 5.0 , 2.7 ,360.26,10.28,15.6
3313,"Kab. Karanganyar, Jawa Tengah",Kab,SMP,371,679,24,36,1110, 33.4 , 61.2 , 2.2 , 3.2 ,411.72,13.33,20.1
3305,"Kab. Kebumen, Jawa Tengah",Kab,SMP,571,866,63,43,1543, 37.0 , 56.1 , 4.1 , 2.8 ,406.19,13.1,16.2
3324,"Kab. Kendal, Jawa Tengah",Kab,SMP,371,596,88,166,1221, 30.4 , 48.8 , 7.2 , 13.6 ,341.96,9.48,14
3310,"Kab. Klaten, Jawa Tengah",Kab,SMP,353,1102,117,58,1630, 21.7 , 67.6 , 7.2 , 3.6 ,423.5,14.08,27
3319,"Kab. Kudus, Jawa Tengah",Kab,SMP,304,422,9,25,760, 40.0 , 55.5 , 1.2 , 3.3 ,480.63,15.15,15.2
3308,"Kab. Magelang, Jawa Tengah",Kab,SMP,313,829,90,131,1363, 23.0 , 60.8 , 6.6 , 9.6 ,301.56,9.25,22.6
3318,"Kab. Pati, Jawa Tengah",Kab,SMP,247,774,97,98,1216, 20.3 , 63.7 , 8.0 , 8.1 ,409.11,13.65,15.1
3326,"Kab. Pekalongan, Jawa Tengah",Kab,SMP,157,629,96,86,968, 16.2 , 65.0 , 9.9 , 8.9 ,377.41,10.75,15.4
3327,"Kab. Pemalang, Jawa Tengah",Kab,SMP,244,1049,177,153,1623, 15.0 , 64.6 , 10.9 , 9.4 ,491.07,11.66,19.8
3303,"Kab. Purbalingga, Jawa Tengah",Kab,SMP,385,662,47,32,1126, 34.2 , 58.8 , 4.2 , 2.8 ,440.42,14.3,18.5
3306,"Kab. Purworejo, Jawa Tengah",Kab,SMP,236,651,100,61,1048, 22.5 , 62.1 , 9.5 , 5.8 ,322.86,10.91,7.7
3317,"Kab. Rembang, Jawa Tengah",Kab,SMP,181,338,45,84,648, 27.9 , 52.2 , 6.9 , 13.0 ,350.34,11.42,16.5
3322,"Kab. Semarang, Jawa Tengah",Kab,SMP,383,741,33,39,1196, 32.0 , 62.0 , 2.8 , 3.3 ,354.82,11.83,9.7
3314,"Kab. Sragen, Jawa Tengah",Kab,SMP,351,745,89,48,1233, 28.5 , 60.4 , 7.2 , 3.9 ,390.58,12.14,14.2
3311,"Kab. Sukoharjo, Jawa Tengah",Kab,SMP,94,875,90,20,1079, 8.7 , 81.1 , 8.3 , 1.9 ,429.96,14.23,18.5
3328,"Kab. Tegal, Jawa Tengah",Kab,SMP,324,1039,45,47,1455, 22.3 , 71.4 , 3.1 , 3.2 ,465.64,13.33,13.6
3323,"Kab. Temanggung, Jawa Tengah",Kab,SMP,272,502,48,47,869, 31.3 , 57.8 , 5.5 , 5.4 ,346.62,11.36,15.7
3312,"Kab. Wonogiri, Jawa Tengah",Kab,SMP,339,850,143,111,1443, 23.5 , 58.9 , 9.9 , 7.7 ,319.99,11.24,23.9
3307,"Kab. Wonosobo, Jawa Tengah",Kab,SMP,183,730,127,47,1087, 16.8 , 67.2 , 11.7 , 4.3 ,307,9.94,16
3371,"Kota Magelang, Jawa Tengah",Kota,SMP,111,224,1,0,336, 33.0 , 66.7 , 0.3 , -   ,472.4,15.45,13.4
3375,"Kota Pekalongan, Jawa Tengah",Kota,SMP,133,245,12,15,405, 32.8 , 60.5 , 3.0 , 3.7 ,457.81,14.44,16.7
3373,"Kota Salatiga, Jawa Tengah",Kota,SMP,110,222,10,7,349, 31.5 , 63.6 , 2.9 , 2.0 ,390.28,14.16,19.9
3374,"Kota Semarang, Jawa Tengah",Kota,SMP,1042,1181,38,88,2349, 44.4 , 50.3 , 1.6 , 3.7 ,362.78,12.55,16.1
3372,"Kota Surakarta, Jawa Tengah",Kota,SMP,547,595,26,52,1220, 44.8 , 48.8 , 2.1 , 4.3 ,435.03,15.56,21.5
3376,"Kota Tegal, Jawa Tengah",Kota,SMP,117,248,46,79,490, 23.9 , 50.6 , 9.4 , 16.1 ,449.87,14.37,12.8
3526,"Kab. Bangkalan, Jawa Timur",Kab,SMP,193,679,136,195,1203, 16.0 , 56.4 , 11.3 , 16.2 ,178.72,5.07,12.8
3510,"Kab. Banyuwangi, Jawa Timur",Kab,SMP,397,1179,103,102,1781, 22.3 , 66.2 , 5.8 , 5.7 ,318.49,9.63,16
3505,"Kab. Blitar, Jawa Timur",Kab,SMP,241,705,162,114,1222, 19.7 , 57.7 , 13.3 , 9.3 ,322.25,10.95,19.9
3522,"Kab. Bojonegoro, Jawa Timur",Kab,SMP,172,628,160,301,1261, 13.6 , 49.8 , 12.7 , 23.9 ,325.72,9.93,13.8
3511,"Kab. Bondowoso, Jawa Timur",Kab,SMP,104,498,34,91,727, 14.3 , 68.5 , 4.7 , 12.5 ,203.34,6.56,13.6
3525,"Kab. Gresik, Jawa Timur",Kab,SMP,403,571,117,94,1185, 34.0 , 48.2 , 9.9 , 7.9 ,322.1,10.63,10.5
3509,"Kab. Jember, Jawa Timur",Kab,SMP,778,1388,153,232,2551, 30.5 , 54.4 , 6.0 , 9.1 ,256.29,7.51,16.4
3517,"Kab. Jombang, Jawa Timur",Kab,SMP,501,755,75,121,1452, 34.5 , 52.0 , 5.2 , 8.3 ,335.85,10.55,14.8
3506,"Kab. Kediri, Jawa Timur",Kab,SMP,354,779,119,107,1359, 26.0 , 57.3 , 8.8 , 7.9 ,481.11,13.66,13.2
3524,"Kab. Lamongan, Jawa Timur",Kab,SMP,191,897,146,220,1454, 13.1 , 61.7 , 10.0 , 15.1 ,242.97,8.67,10.8
3508,"Kab. Lumajang, Jawa Timur",Kab,SMP,355,616,106,51,1128, 31.5 , 54.6 , 9.4 , 4.5 ,251.76,7.93,18
3519,"Kab. Madiun, Jawa Timur",Kab,SMP,219,362,85,108,774, 28.3 , 46.8 , 11.0 , 14.0 ,414.96,15.07,13.1
3520,"Kab. Magetan, Jawa Timur",Kab,SMP,157,600,50,76,883, 17.8 , 68.0 , 5.7 , 8.6 ,372.78,16.3,17.6
3507,"Kab. Malang, Jawa Timur",Kab,SMP,654,1706,224,208,2792, 23.4 , 61.1 , 8.0 , 7.4 ,251.33,8.09,17.3
3516,"Kab. Mojokerto, Jawa Timur",Kab,SMP,187,766,111,137,1201, 15.6 , 63.8 , 9.2 , 11.4 ,285.03,9.34,12.4
3518,"Kab. Nganjuk, Jawa Timur",Kab,SMP,249,773,83,144,1249, 19.9 , 61.9 , 6.6 , 11.5 ,445.99,14.78,19
3521,"Kab. Ngawi, Jawa Timur",Kab,SMP,258,467,122,144,991, 26.0 , 47.1 , 12.3 , 14.5 ,346.11,11.59,14.5
3501,"Kab. Pacitan, Jawa Timur",Kab,SMP,263,385,26,22,696, 37.8 , 55.3 , 3.7 , 3.2 ,247.75,9.19,17.7
3528,"Kab. Pamekasan, Jawa Timur",Kab,SMP,87,540,110,127,864, 10.1 , 62.5 , 12.7 , 14.7 ,127.22,4.21,15.2
3514,"Kab. Pasuruan, Jawa Timur",Kab,SMP,295,958,68,93,1414, 20.9 , 67.8 , 4.8 , 6.6 ,310.79,9.54,14.9
3502,"Kab. Ponorogo, Jawa Timur",Kab,SMP,247,662,57,51,1017, 24.3 , 65.1 , 5.6 , 5.0 ,283.64,10.37,14.1
3513,"Kab. Probolinggo, Jawa Timur",Kab,SMP,219,828,102,99,1248, 17.5 , 66.3 , 8.2 , 7.9 ,164.2,5.43,16.4
3527,"Kab. Sampang, Jawa Timur",Kab,SMP,166,722,141,104,1133, 14.7 , 63.7 , 12.4 , 9.2 ,133.08,3.94,11.4
3515,"Kab. Sidoarjo, Jawa Timur",Kab,SMP,1131,1281,38,46,2496, 45.3 , 51.3 , 1.5 , 1.8 ,474.54,13.76,19.9
3529,"Kab. Sumenep, Jawa Timur",Kab,SMP,176,478,140,122,916, 19.2 , 52.2 , 15.3 , 13.3 ,141.18,5.24,13.4
3503,"Kab. Trenggalek, Jawa Timur",Kab,SMP,199,593,50,69,911, 21.8 , 65.1 , 5.5 , 7.6 ,307.62,10.92,17
3523,"Kab. Tuban, Jawa Timur",Kab,SMP,241,701,46,113,1101, 21.9 , 63.7 , 4.2 , 10.3 ,365.67,12.11,14.4
3504,"Kab. Tulungagung, Jawa Timur",Kab,SMP,304,774,49,77,1204, 25.2 , 64.3 , 4.1 , 6.4 ,481.48,14.99,14.7
3579,"Kota Batu, Jawa Timur",Kota,SMP,87,204,1,2,294, 29.6 , 69.4 , 0.3 , 0.7 ,317.58,11.65,9.9
3572,"Kota Blitar, Jawa Timur",Kota,SMP,74,242,2,2,320, 23.1 , 75.6 , 0.6 , 0.6 ,461.5,15.4,18.1
3571,"Kota Kediri, Jawa Timur",Kota,SMP,153,303,19,26,501, 30.5 , 60.5 , 3.8 , 5.2 ,488.52,14.31,15.1
3577,"Kota Madiun, Jawa Timur",Kota,SMP,147,212,9,0,368, 39.9 , 57.6 , 2.4 , -   ,463.9,16.9,23.1
3573,"Kota Malang, Jawa Timur",Kota,SMP,565,649,4,2,1220, 46.3 , 53.2 , 0.3 , 0.2 ,392.34,11.99,22.7
3576,"Kota Mojokerto, Jawa Timur",Kota,SMP,92,205,2,5,304, 30.3 , 67.4 , 0.7 , 1.6 ,496.39,15.83,13
3575,"Kota Pasuruan, Jawa Timur",Kota,SMP,152,151,6,16,325, 46.8 , 46.5 , 1.8 , 4.9 ,348.93,11.15,11.3
3578,"Kota Surabaya, Jawa Timur",Kota,SMP,1925,1795,29,40,3789, 50.8 , 47.4 , 0.8 , 1.1 ,379.79,10.84,17.6
6102,"Kab. Bengkayang, Kalimantan Barat",Kab,SMP,146,219,64,111,540, 27.0 , 40.6 , 11.9 , 20.6 ,170.41,5.04,11.7
6108,"Kab. Kapuas Hulu, Kalimantan Barat",Kab,SMP,108,328,46,41,523, 20.7 , 62.7 , 8.8 , 7.8 ,124.4,4.9,9.9
6111,"Kab. Kayong Utara, Kalimantan Barat",Kab,SMP,99,125,15,4,243, 40.7 , 51.4 , 6.2 , 1.6 ,148.59,5.78,12.3
6106,"Kab. Ketapang, Kalimantan Barat",Kab,SMP,180,470,86,121,857, 21.0 , 54.8 , 10.0 , 14.1 ,181.52,5.82,9.1
6112,"Kab. Kuburaya, Kalimantan Barat",Kab,SMP,184,411,78,149,822, 22.4 , 50.0 , 9.5 , 18.1 ,161.4,5.61,15.1
6103,"Kab. Landak, Kalimantan Barat",Kab,SMP,199,370,113,69,751, 26.5 , 49.3 , 15.0 , 9.2 ,210.16,6.16,12.6
6110,"Kab. Melawi, Kalimantan Barat",Kab,SMP,60,228,75,103,466, 12.9 , 48.9 , 16.1 , 22.1 ,99.46,4.04,9.6
6104,"Kab. Mempawah, Kalimantan Barat",Kab,SMP,133,177,8,14,332, 40.1 , 53.3 , 2.4 , 4.2 ,206.41,6.64,12.5
6101,"Kab. Sambas, Kalimantan Barat",Kab,SMP,218,561,103,54,936, 23.3 , 59.9 , 11.0 , 5.8 ,214.66,6.79,13.1
6109,"Kab. Sekadau, Kalimantan Barat",Kab,SMP,109,207,32,37,385, 28.3 , 53.8 , 8.3 , 9.6 ,156.35,5.33,10.4
6171,"Kota Pontianak, Kalimantan Barat",Kota,SMP,396,384,53,86,919, 43.1 , 41.8 , 5.8 , 9.4 ,378.82,9.7,18.6
6172,"Kota Singkawang, Kalimantan Barat",Kota,SMP,86,227,39,38,390, 22.1 , 58.2 , 10.0 , 9.7 ,319.06,11.56,14.5
6311,"Kab. Balangan, Kalimantan Selatan",Kab,SMP,39,106,5,4,154, 25.3 , 68.8 , 3.2 , 2.6 ,126.29,6.33,12
6303,"Kab. Banjar, Kalimantan Selatan",Kab,SMP,185,327,30,15,557, 33.2 , 58.7 , 5.4 , 2.7 ,383.33,12.43,14.7
6304,"Kab. Barito Kuala, Kalimantan Selatan",Kab,SMP,103,283,28,16,430, 24.0 , 65.8 , 6.5 , 3.7 ,171.94,7.3,11.9
6306,"Kab. Hulu Sungai Selatan, Kalimantan Selatan",Kab,SMP,50,171,5,14,240, 20.8 , 71.3 , 2.1 , 5.8 ,148.03,7.09,11.4
6309,"Kab. Tabalong, Kalimantan Selatan",Kab,SMP,117,207,29,22,375, 31.2 , 55.2 , 7.7 , 5.9 ,129.07,5.53,15.8
6310,"Kab. Tanah Bumbu, Kalimantan Selatan",Kab,SMP,109,257,40,37,443, 24.6 , 58.0 , 9.0 , 8.4 ,194.9,6.52,12.8
6301,"Kab. Tanah Laut, Kalimantan Selatan",Kab,SMP,73,291,31,20,415, 17.6 , 70.1 , 7.5 , 4.8 ,201.67,7.42,14.4
6372,"Kota Banjarbaru, Kalimantan Selatan",Kota,SMP,134,190,2,2,328, 40.9 , 57.9 , 0.6 , 0.6 ,423.57,14.95,12.2
6371,"Kota Banjarmasin, Kalimantan Selatan",Kota,SMP,383,444,14,33,874, 43.8 , 50.8 , 1.6 , 3.8 ,400.16,12.47,19.5
6204,"Kab. Barito Selatan, Kalimantan Tengah",Kab,SMP,72,191,30,26,319, 22.6 , 59.9 , 9.4 , 8.2 ,98.48,4.68,16.5
6212,"Kab. Barito Timur, Kalimantan Tengah",Kab,SMP,66,129,6,11,212, 31.1 , 60.8 , 2.8 , 5.2 ,156,6.61,9.8
6205,"Kab. Barito Utara, Kalimantan Tengah",Kab,SMP,66,155,21,34,276, 23.9 , 56.2 , 7.6 , 12.3 ,168.1,5.69,13.1
6211,"Kab. Gunung Mas, Kalimantan Tengah",Kab,SMP,69,183,33,41,326, 21.2 , 56.1 , 10.1 , 12.6 ,111.05,4.93,13.4
6203,"Kab. Kapuas, Kalimantan Tengah",Kab,SMP,102,386,56,94,638, 16.0 , 60.5 , 8.8 , 14.7 ,108.92,5.19,11.8
6209,"Kab. Katingan, Kalimantan Tengah",Kab,SMP,93,283,21,18,415, 22.4 , 68.2 , 5.1 , 4.3 ,106.36,4.97,12.3
6202,"Kab. Kotawaringin Timur, Kalimantan Tengah",Kab,SMP,138,365,71,79,653, 21.1 , 55.9 , 10.9 , 12.1 ,176.73,5.67,12.9
6207,"Kab. Lamandau, Kalimantan Tengah",Kab,SMP,74,122,1,9,206, 35.9 , 59.2 , 0.5 , 4.4 ,94.28,4.72,9.8
6213,"Kab. Murung Raya, Kalimantan Tengah",Kab,SMP,86,143,20,33,282, 30.5 , 50.7 , 7.1 , 11.7 ,92.76,4.46,11.8
6210,"Kab. Pulang Pisau, Kalimantan Tengah",Kab,SMP,104,127,26,23,280, 37.1 , 45.4 , 9.3 , 8.2 ,129.75,5.8,11.4
6208,"Kab. Seruyan, Kalimantan Tengah",Kab,SMP,110,209,9,9,337, 32.6 , 62.0 , 2.7 , 2.7 ,126.55,5.64,9.7
6271,"Kota Palangka Raya, Kalimantan Tengah",Kota,SMP,96,257,33,27,413, 23.2 , 62.2 , 8.0 , 6.5 ,223.2,7.16,12.4
6405,"Kab. Berau, Kalimantan Timur",Kab,SMP,176,221,13,2,412, 42.7 , 53.6 , 3.2 , 0.5 ,225.72,7.15,15.3
6402,"Kab. Kutai Barat, Kalimantan Timur",Kab,SMP,165,164,4,7,340, 48.5 , 48.2 , 1.2 , 2.1 ,158.42,5.55,5.6
6403,"Kab. Kutai Kartanegara, Kalimantan Timur",Kab,SMP,256,677,67,61,1061, 24.1 , 63.8 , 6.3 , 5.7 ,222.42,8.12,15.1
6404,"Kab. Kutai Timur, Kalimantan Timur",Kab,SMP,201,401,21,22,645, 31.2 , 62.2 , 3.3 , 3.4 ,181.95,6.25,15.8
6401,"Kab. Paser, Kalimantan Timur",Kab,SMP,135,287,31,18,471, 28.7 , 60.9 , 6.6 , 3.8 ,168.48,6.15,14.4
6409,"Kab. Penajam Paser Utara, Kalimantan Timur",Kab,SMP,131,144,3,0,278, 47.1 , 51.8 , 1.1 , -   ,235.28,8.93,15.7
6471,"Kota Balikpapan, Kalimantan Timur",Kota,SMP,482,364,9,18,873, 55.2 , 41.7 , 1.0 , 2.1 ,475.05,13.24,16
6474,"Kota Bontang, Kalimantan Timur",Kota,SMP,184,92,16,11,303, 60.7 , 30.4 , 5.3 , 3.6 ,285.45,9.86,14.9
6472,"Kota Samarinda, Kalimantan Timur",Kota,SMP,401,546,64,63,1074, 37.3 , 50.8 , 6.0 , 5.9 ,413.62,11.29,18
6502,"Kab. Bulungan, Kalimantan Utara",Kab,SMP,47,159,36,40,282, 16.7 , 56.4 , 12.8 , 14.2 ,130.87,4.73,16.9
6501,"Kab. Malinau, Kalimantan Utara",Kab,SMP,56,101,3,10,170, 32.9 , 59.4 , 1.8 , 5.9 ,142.42,5.12,12.6
6504,"Kab. Nunukan, Kalimantan Utara",Kab,SMP,100,153,32,13,298, 33.6 , 51.3 , 10.7 , 4.4 ,190.56,5.4,13.2
6571,"Kota Tarakan, Kalimantan Utara",Kota,SMP,172,112,0,2,286, 60.1 , 39.2 , -   , 0.7 ,576.75,15.69,17.1
2102,"Kab. Bintan, Kepulauan Riau",Kab,SMP,72,125,32,40,269, 26.8 , 46.5 , 11.9 , 14.9 ,226.33,7.63,15.3
2101,"Kab. Karimun, Kepulauan Riau",Kab,SMP,154,227,22,19,422, 36.5 , 53.8 , 5.2 , 4.5 ,219.32,6.32,16.7
2171,"Kota Batam, Kepulauan Riau",Kota,SMP,722,586,36,30,1374, 52.5 , 42.6 , 2.6 , 2.2 ,324.79,8.8,19.8
2172,"Kota Tanjungpinang, Kepulauan Riau",Kota,SMP,91,157,52,20,320, 28.4 , 49.1 , 16.3 , 6.3 ,384.15,9.19,13.1
1803,"Kab. Lampung Selatan, Lampung",Kab,SMP,200,708,107,100,1115, 17.9 , 63.5 , 9.6 , 9.0 ,237.74,6.94,11.1
1805,"Kab. Lampung Tengah, Lampung",Kab,SMP,547,1028,122,143,1840, 29.7 , 55.9 , 6.6 , 7.8 ,242.54,8.07,19
1804,"Kab. Lampung Timur, Lampung",Kab,SMP,257,868,111,152,1388, 18.5 , 62.5 , 8.0 , 11.0 ,239.72,7.58,11.8
1806,"Kab. Lampung Utara, Lampung",Kab,SMP,232,406,96,164,898, 25.8 , 45.2 , 10.7 , 18.3 ,240.81,7.04,20
1810,"Kab. Pringsewu, Lampung",Kab,SMP,149,294,67,111,621, 24.0 , 47.3 , 10.8 , 17.9 ,310.63,8.33,12.9
1802,"Kab. Tanggamus, Lampung",Kab,SMP,136,408,59,71,674, 20.2 , 60.5 , 8.8 , 10.5 ,248.63,7.88,13.8
1808,"Kab. Tulang Bawang, Lampung",Kab,SMP,140,343,62,81,626, 22.4 , 54.8 , 9.9 , 12.9 ,182.76,5.5,9.6
1807,"Kab. Way Kanan, Lampung",Kab,SMP,99,343,77,166,685, 14.5 , 50.1 , 11.2 , 24.2 ,208.3,6.65,13.3
1871,"Kota Bandar Lampung, Lampung",Kota,SMP,590,851,71,56,1568, 37.6 , 54.3 , 4.5 , 3.6 ,384.15,11.86,17.9
1872,"Kota Metro, Lampung",Kota,SMP,124,209,10,26,369, 33.6 , 56.6 , 2.7 , 7.0 ,414.48,13.83,12.3
8109,"Kab. Buru Selatan, Maluku",Kab,SMP,32,83,27,54,196, 16.3 , 42.3 , 13.8 , 27.6 ,107.14,3.77,10.2
8103,"Kab. Maluku Tengah, Maluku",Kab,SMP,277,572,97,99,1045, 26.5 , 54.7 , 9.3 , 9.5 ,167.88,6.59,15
8102,"Kab. Maluku Tenggara, Maluku",Kab,SMP,85,134,18,18,255, 33.3 , 52.5 , 7.1 , 7.1 ,134.6,4.51,0
8101,"Kab. Maluku Tenggara Barat, Maluku",Kab,SMP,82,176,39,73,370, 22.2 , 47.6 , 10.5 , 19.7 ,131.77,4.82,0
8106,"Kab. Seram Bagian Barat, Maluku",Kab,SMP,116,237,69,72,494, 23.5 , 48.0 , 14.0 , 14.6 ,161.64,5,11.7
8171,"Kota Ambon, Maluku",Kota,SMP,127,314,37,61,539, 23.6 , 58.3 , 6.9 , 11.3 ,380.54,10.41,23.1
8201,"Kab. Halmahera Barat, Maluku Utara",Kab,SMP,86,166,13,40,305, 28.2 , 54.4 , 4.3 , 13.1 ,101.29,3.69,2.2
8204,"Kab. Halmahera Selatan, Maluku Utara",Kab,SMP,75,205,73,122,475, 15.8 , 43.2 , 15.4 , 25.7 ,115.92,3.58,7.6
8202,"Kab. Halmahera Tengah, Maluku Utara",Kab,SMP,32,67,25,14,138, 23.2 , 48.6 , 18.1 , 10.1 ,92.35,4.23,8.7
8206,"Kab. Halmahera Timur, Maluku Utara",Kab,SMP,56,78,34,30,198, 28.3 , 39.4 , 17.2 , 15.2 ,121.38,4.29,6.8
8205,"Kab. halmahera Utara, Maluku Utara",Kab,SMP,145,128,12,38,323, 44.9 , 39.6 , 3.7 , 11.8 ,182.29,5.24,0.7
8207,"Kab. Kepulauan Morotai, Maluku Utara",Kab,SMP,39,67,0,16,122, 32.0 , 54.9 , -   , 13.1 ,122.6,2.92,8
8203,"Kab. Kepulauan Sula, Maluku Utara",Kab,SMP,49,117,41,43,250, 19.6 , 46.8 , 16.4 , 17.2 ,102.49,3.75,9
8271,"Kota Ternate, Maluku Utara",Kota,SMP,39,193,63,21,316, 12.3 , 61.1 , 19.9 , 6.6 ,328.23,9.42,18
8272,"Kota Tidore Kepulauan, Maluku Utara",Kota,SMP,77,106,40,46,269, 28.6 , 39.4 , 14.9 , 17.1 ,127.14,5.56,14.9
5206,"Kab. Bima, Nusa Tenggara Barat",Kab,SMP,272,498,108,158,1036, 26.3 , 48.1 , 10.4 , 15.3 ,198.95,7.38,14.3
5205,"Kab. Dompu, Nusa Tenggara Barat",Kab,SMP,79,249,65,115,508, 15.6 , 49.0 , 12.8 , 22.6 ,236.6,7.23,16.5
5201,"Kab. Lombok Barat, Nusa Tenggara Barat",Kab,SMP,162,455,66,49,732, 22.1 , 62.2 , 9.0 , 6.7 ,226.88,8.05,13.9
5202,"Kab. Lombok Tengah, Nusa Tenggara Barat",Kab,SMP,238,470,155,228,1091, 21.8 , 43.1 , 14.2 , 20.9 ,177.21,6.1,19.8
5203,"Kab. Lombok Timur, Nusa Tenggara Barat",Kab,SMP,343,743,172,167,1425, 24.1 , 52.1 , 12.1 , 11.7 ,201.03,6.13,15.1
5208,"Kab. Lombok Utara, Nusa Tenggara Barat",Kab,SMP,105,168,6,6,285, 36.8 , 58.9 , 2.1 , 2.1 ,214.18,7.44,10.1
5204,"Kab. Sumbawa, Nusa Tenggara Barat",Kab,SMP,221,319,88,122,750, 29.5 , 42.5 , 11.7 , 16.3 ,191.55,6.44,12.9
5207,"Kab. Sumbawa Barat, Nusa Tenggara Barat",Kab,SMP,47,156,30,8,241, 19.5 , 64.7 , 12.4 , 3.3 ,164.47,7.41,10
5272,"Kota Bima, Nusa Tenggara Barat",Kota,SMP,40,148,12,43,243, 16.5 , 60.9 , 4.9 , 17.7 ,293.1,11.7,17.2
5271,"Kota Mataram, Nusa Tenggara Barat",Kota,SMP,209,417,9,8,643, 32.5 , 64.9 , 1.4 , 1.2 ,516.36,15.46,15
5307,"Kab. Alor, Nusa Tenggara Timur",Kab,SMP,100,300,55,68,523, 19.1 , 57.4 , 10.5 , 13.0 ,116.6,4.27,13.3
5306,"Kab. Belu, Nusa Tenggara Timur",Kab,SMP,140,269,16,43,468, 29.9 , 57.5 , 3.4 , 9.2 ,319.15,9.53,9.5
