Kode,Provinsi,Kabupaten,Jenjang,Baik,Rusak_Ringan,Rusak_Sedang,Rusak_Berat,Jumlah,pct_Baik,pct_Rusak_Ringan,pct_Rusak_Sedang,pct_Rusak_Berat,Rasio_siswa,Rasio_ruang_kelas,pct_anggaran_2016
1114,"Kab. Aceh Tamiang, Aceh",Kab,SD,461,650,56,55,1222, 37.7 , 53.2 , 4.6 , 4.5 ,194.11,7.14,11.1
1106,"Kab. Aceh Tengah, Aceh",Kab,SD,337,681,105,139,1262, 26.7 , 54.0 , 8.3 , 11.0 ,103.26,5.29,12
1104,"Kab. Aceh Tenggara, Aceh",Kab,SD,187,689,113,107,1096, 17.1 , 62.9 , 10.3 , 9.8 ,143.04,5.69,11.2
1105,"Kab. Aceh Timur, Aceh",Kab,SD,458,1103,157,251,1969, 23.3 , 56.0 , 8.0 , 12.7 ,162.23,6.27,9.5
1111,"Kab. Aceh Utara, Aceh",Kab,SD,538,1482,331,461,2812, 19.1 , 52.7 , 11.8 , 16.4 ,166.07,6.22,10.1
1117,"Kab. Bener Meriah, Aceh",Kab,SD,310,508,9,13,840, 36.9 , 60.5 , 1.1 , 1.5 ,113.06,6.31,13.6
1110,"Kab. Bireuen, Aceh",Kab,SD,351,974,171,260,1756, 20.0 , 55.5 , 9.7 , 14.8 ,138.64,6.86,10.8
1113,"Kab. Gayo Lues, Aceh",Kab,SD,130,404,45,35,614, 21.2 , 65.8 , 7.3 , 5.7 ,121.78,5.91,9.7
1109,"Kab. Pidie, Aceh",Kab,SD,478,966,209,246,1899, 25.2 , 50.9 , 11.0 , 13.0 ,130.19,6.68,12
1118,"Kab. Pidie Jaya, Aceh",Kab,SD,120,312,87,120,639, 18.8 , 48.8 , 13.6 , 18.8 ,129.51,6.39,8.7
1171,"Kota Banda Aceh, Aceh",Kota,SD,356,445,11,22,834, 42.7 , 53.4 , 1.3 , 2.6 ,263.77,9.06,16.5
1174,"Kota Lhokseumawe, Aceh",Kota,SD,264,334,15,25,638, 41.4 , 52.4 , 2.4 , 3.9 ,274.88,8.85,7.1
5103,"Kab. Badung, Bali",Kab,SD,1183,942,44,68,2237, 52.9 , 42.1 , 2.0 , 3.0 ,215.29,7.15,13.4
5106,"Kab. Bangli, Bali",Kab,SD,418,590,20,20,1048, 39.9 , 56.3 , 1.9 , 1.9 ,139.97,5.66,18.7
5108,"Kab. Buleleng, Bali",Kab,SD,1115,1693,128,73,3009, 37.1 , 56.3 , 4.3 , 2.4 ,143.08,5.9,22.8
5104,"Kab. Gianyar, Bali",Kab,SD,543,1282,57,48,1930, 28.1 , 66.4 , 3.0 , 2.5 ,161.86,6.21,13.9
5101,"Kab. Jembrana, Bali",Kab,SD,395,639,36,78,1148, 34.4 , 55.7 , 3.1 , 6.8 ,133.36,5.78,14.8
5107,"Kab. Karang Asem, Bali",Kab,SD,658,1575,120,95,2448, 26.9 , 64.3 , 4.9 , 3.9 ,125.31,6.38,23.9
5105,"Kab. Klungkung, Bali",Kab,SD,283,619,15,39,956, 29.6 , 64.7 , 1.6 , 4.1 ,127.13,6.86,14.3
5102,"Kab. Tabanan, Bali",Kab,SD,754,1236,75,41,2106, 35.8 , 58.7 , 3.6 , 1.9 ,112.9,6.13,21.8
5171,"Kota Denpasar, Bali",Kota,SD,1263,802,30,76,2171, 58.2 , 36.9 , 1.4 , 3.5 ,378.25,8.87,13.8
1901,"Kab. Bangka, Bangka Belitung",Kab,SD,610,726,68,66,1470, 41.5 , 49.4 , 4.6 , 4.5 ,201.64,7.99,14.6
1903,"Kab. Bangka Barat, Bangka Belitung",Kab,SD,468,545,27,33,1073, 43.6 , 50.8 , 2.5 , 3.1 ,180.27,7.96,16.1
1905,"Kab. Bangka Selatan, Bangka Belitung",Kab,SD,302,535,36,49,922, 32.8 , 58.0 , 3.9 , 5.3 ,262.31,10.25,18.3
1904,"Kab. Bangka Tengah, Bangka Belitung",Kab,SD,306,438,53,52,849, 36.0 , 51.6 , 6.2 , 6.1 ,238.77,7.83,16.1
1902,"Kab. Belitung, Bangka Belitung",Kab,SD,292,424,69,101,886, 33.0 , 47.9 , 7.8 , 11.4 ,161.46,6.7,14.7
1906,"Kab. Belitung Timur, Bangka Belitung",Kab,SD,274,405,43,21,743, 36.9 , 54.5 , 5.8 , 2.8 ,125.36,6.97,14.5
1971,"Kota Pangkalpinang, Bangka Belitung",Kota,SD,373,339,12,11,735, 50.7 , 46.1 , 1.6 , 1.5 ,269.43,8.22,12.4
3602,"Kab. Lebak, Banten",Kab,SD,1525,2291,560,827,5203, 29.3 , 44.0 , 10.8 , 15.9 ,185.49,5.15,13.9
3601,"Kab. Pandeglang, Banten",Kab,SD,1209,3843,382,410,5844, 20.7 , 65.8 , 6.5 , 7.0 ,171.31,5.9,14.9
3604,"Kab. Serang, Banten",Kab,SD,1015,3194,351,637,5197, 19.5 , 61.5 , 6.8 , 12.3 ,227.6,6.03,16.6
3603,"Kab. Tangerang, Banten",Kab,SD,2934,4707,450,573,8664, 33.9 , 54.3 , 5.2 , 6.6 ,326.93,7.49,15.8
3672,"Kota Cilegon, Banten",Kota,SD,474,941,46,34,1495, 31.7 , 62.9 , 3.1 , 2.3 ,261.09,7.69,0.4
3673,"Kota Serang, Banten",Kota,SD,747,1297,51,82,2177, 34.3 , 59.6 , 2.3 , 3.8 ,310.15,7.95,22
3671,"Kota Tangerang, Banten",Kota,SD,2310,1842,97,138,4387, 52.7 , 42.0 , 2.2 , 3.1 ,382.26,8.21,20.2
3674,"Kota Tangerang Selatan, Banten",Kota,SD,1979,1815,107,158,4059, 48.8 , 44.7 , 2.6 , 3.9 ,453.06,10.74,14.8
1701,"Kab. Bengkulu Selatan, Bengkulu",Kab,SD,212,554,108,138,1012, 20.9 , 54.7 , 10.7 , 13.6 ,149.49,6.97,13.6
1709,"Kab. Bengkulu Tengah, Bengkulu",Kab,SD,271,320,16,46,653, 41.5 , 49.0 , 2.5 , 7.0 ,137.14,6.59,11.5
1703,"Kab. Bengkulu Utara, Bengkulu",Kab,SD,282,995,188,225,1690, 16.7 , 58.9 , 11.1 , 13.3 ,156.92,6.63,9.8
1704,"Kab. Kaur, Bengkulu",Kab,SD,181,525,87,81,874, 20.7 , 60.1 , 10.0 , 9.3 ,111.77,5.68,12
1708,"Kab. Kepahiang, Bengkulu",Kab,SD,179,398,53,60,690, 25.9 , 57.7 , 7.7 , 8.7 ,151.24,6.81,11.8
1707,"Kab. Lebong, Bengkulu",Kab,SD,129,404,67,60,660, 19.5 , 61.2 , 10.2 , 9.1 ,118.19,5.88,10.9
1706,"Kab. Muko-muko, Bengkulu",Kab,SD,251,720,70,66,1107, 22.7 , 65.0 , 6.3 , 6.0 ,171,7.63,10.5
1702,"Kab. Rejang Lebong, Bengkulu",Kab,SD,300,935,77,111,1423, 21.1 , 65.7 , 5.4 , 7.8 ,172.28,7.17,11.3
1705,"Kab. Seluma, Bengkulu",Kab,SD,137,644,165,256,1202, 11.4 , 53.6 , 13.7 , 21.3 ,127.17,5.73,10.1
1771,"Kota Bengkulu, Bengkulu",Kota,SD,351,675,58,101,1185, 29.6 , 57.0 , 4.9 , 8.5 ,394.59,11.43,13.7
3402,"Kab. Bantul, D.I. Yogyakarta",Kab,SD,929,2154,95,103,3281, 28.3 , 65.7 , 2.9 , 3.1 ,205.93,8.6,16.6
3403,"Kab. Gunung Kidul, D.I. Yogyakarta",Kab,SD,957,1896,133,126,3112, 30.8 , 60.9 , 4.3 , 4.0 ,107.57,6.16,18
3401,"Kab. Kulon Progo, D.I. Yogyakarta",Kab,SD,596,1296,110,69,2071, 28.8 , 62.6 , 5.3 , 3.3 ,101.96,5.95,13
3404,"Kab. Sleman, D.I. Yogyakarta",Kab,SD,1167,2486,65,49,3767, 31.0 , 66.0 , 1.7 , 1.3 ,176.42,7.13,12.2
3471,"Kota Yogyakarta, D.I. Yogyakarta",Kota,SD,727,990,23,12,1752, 41.5 , 56.5 , 1.3 , 0.7 ,260.93,10.24,19.6
3174,"Kota Jakarta Barat, D.K.I. Jakarta",Kota,SD,3906,2106,115,184,6311, 61.9 , 33.4 , 1.8 , 2.9 ,302.78,8.77,
3173,"Kota Jakarta Pusat, D.K.I. Jakarta",Kota,SD,1151,1508,171,205,3035, 37.9 , 49.7 , 5.6 , 6.8 ,246.75,7.54,
3171,"Kota Jakarta Selatan, D.K.I. Jakarta",Kota,SD,3475,2048,128,230,5881, 59.1 , 34.8 , 2.2 , 3.9 ,291.6,8.2,
3172,"Kota Jakarta Timur, D.K.I. Jakarta",Kota,SD,4529,3055,177,288,8049, 56.3 , 38.0 , 2.2 , 3.6 ,345.92,9.11,
3175,"Kota Jakarta Utara, D.K.I. Jakarta",Kota,SD,2210,1647,92,280,4229, 52.3 , 38.9 , 2.2 , 6.6 ,318.7,8.29,
7501,"Kab. Boalemo, Gorontalo",Kab,SD,272,473,91,108,944, 28.8 , 50.1 , 9.6 , 11.4 ,133.67,5.61,12.2
7504,"Kab. Bone Bolango, Gorontalo",Kab,SD,223,357,131,184,895, 24.9 , 39.9 , 14.6 , 20.6 ,138.64,6.71,15.4
7502,"Kab. Gorontalo, Gorontalo",Kab,SD,706,1014,94,192,2006, 35.2 , 50.5 , 4.7 , 9.6 ,156.45,6.33,13.8
7505,"Kab. Gorontalo Utara, Gorontalo",Kab,SD,287,426,48,84,845, 34.0 , 50.4 , 5.7 , 9.9 ,115.22,5.83,10.7
7503,"Kab. Pohuwato, Gorontalo",Kab,SD,309,497,12,31,849, 36.4 , 58.5 , 1.4 , 3.7 ,137.69,6.59,12.7
7502,"Kota Gorontalo, Gorontalo",Kota,SD,376,470,36,23,905, 41.5 , 51.9 , 4.0 , 2.5 ,156.45,6.33,13.8
1504,"Kab. Batang Hari, Jambi",Kab,SD,392,985,42,92,1511, 25.9 , 65.2 , 2.8 , 6.1 ,156.33,6.62,11.9
1509,"Kab. Bungo, Jambi",Kab,SD,413,1002,110,192,1717, 24.1 , 58.4 , 6.4 , 11.2 ,174.82,6.78,16.2
1501,"Kab. Kerinci, Jambi",Kab,SD,316,829,161,176,1482, 21.3 , 55.9 , 10.9 , 11.9 ,104.5,5.5,14.5
1502,"Kab. Merangin, Jambi",Kab,SD,144,1512,312,121,2089, 6.9 , 72.4 , 14.9 , 5.8 ,143.87,5.9,12.1
1505,"Kab. Muaro Jambi, Jambi",Kab,SD,465,999,123,300,1887, 24.6 , 52.9 , 6.5 , 15.9 ,172.53,6.72,11.9
1503,"Kab. Sarolangun, Jambi",Kab,SD,216,930,211,244,1601, 13.5 , 58.1 , 13.2 , 15.2 ,146.07,5.87,18.7
1507,"Kab. Tanjung Jabung Barat, Jambi",Kab,SD,319,839,189,292,1639, 19.5 , 51.2 , 11.5 , 17.8 ,176.2,6.92,15.7
1506,"Kab. Tanjung Jabung Timur, Jambi",Kab,SD,191,750,185,272,1398, 13.7 , 53.6 , 13.2 , 19.5 ,119.49,5.63,17.1
1508,"Kab. Tebo, Jambi",Kab,SD,406,1083,166,143,1798, 22.6 , 60.2 , 9.2 , 8.0 ,162.18,6.47,15.4
1571,"Kota Jambi, Jambi",Kota,SD,466,1113,306,344,2229, 20.9 , 49.9 , 13.7 , 15.4 ,285.32,8.32,19.5
1572,"Kota Sungai Penuh, Jambi",Kota,SD,117,226,75,103,521, 22.5 , 43.4 , 14.4 , 19.8 ,133.3,5.67,17.8
3204,"Kab. Bandung, Jawa Barat",Kab,SD,2174,5809,661,723,9367, 23.2 , 62.0 , 7.1 , 7.7 ,263.27,5.7,18.1
3217,"Kab. Bandung Barat, Jawa Barat",Kab,SD,742,2724,612,826,4904, 15.1 , 55.5 , 12.5 , 16.8 ,227.79,5.67,18.7
3216,"Kab. Bekasi, Jawa Barat",Kab,SD,2549,4342,553,720,8164, 31.2 , 53.2 , 6.8 , 8.8 ,338.93,7.26,19.9
3201,"Kab. Bogor, Jawa Barat",Kab,SD,3323,8396,873,820,13412, 24.8 , 62.6 , 6.5 , 6.1 ,288.14,6.34,15.1
3207,"Kab. Ciamis, Jawa Barat",Kab,SD,918,3042,433,326,4719, 19.5 , 64.5 , 9.2 , 6.9 ,130.71,5.69,14.1
3203,"Kab. Cianjur, Jawa Barat",Kab,SD,1058,5255,945,1263,8521, 12.4 , 61.7 , 11.1 , 14.8 ,199.45,5.7,23
3209,"Kab. Cirebon, Jawa Barat",Kab,SD,1320,4235,393,482,6430, 20.5 , 65.9 , 6.1 , 7.5 ,222.96,6.12,14.5
3205,"Kab. Garut, Jawa Barat",Kab,SD,1335,5982,1212,1041,9570, 13.9 , 62.5 , 12.7 , 10.9 ,186.59,4.84,14.1
3212,"Kab. Indramayu, Jawa Barat",Kab,SD,930,3375,668,981,5954, 15.6 , 56.7 , 11.2 , 16.5 ,183.36,5.2,11.9
3215,"Kab. Karawang, Jawa Barat",Kab,SD,1100,3774,699,1167,6740, 16.3 , 56.0 , 10.4 , 17.3 ,255.1,6.18,13.9
3208,"Kab. Kuningan, Jawa Barat",Kab,SD,584,2327,668,892,4471, 13.1 , 52.0 , 14.9 , 20.0 ,160.6,5.52,20.1
3210,"Kab. Majalengka, Jawa Barat",Kab,SD,1785,1689,612,461,4547, 39.3 , 37.1 , 13.5 , 10.1 ,174.43,5.94,13.5
3218,"Kab. Pangandaran, Jawa Barat",Kab,SD,304,1010,255,301,1870, 16.3 , 54.0 , 13.6 , 16.1 ,114.56,5.27,19.9
3214,"Kab. Purwakarta, Jawa Barat",Kab,SD,503,1987,213,296,2999, 16.8 , 66.3 , 7.1 , 9.9 ,225.44,5.9,15.1
3213,"Kab. Subang, Jawa Barat",Kab,SD,664,3563,771,789,5787, 11.5 , 61.6 , 13.3 , 13.6 ,166.75,5.38,0.7
3202,"Kab. Sukabumi, Jawa Barat",Kab,SD,1270,4762,969,1275,8276, 15.3 , 57.5 , 11.7 , 15.4 ,199.61,5.79,13.1
3211,"Kab. Sumedang, Jawa Barat",Kab,SD,571,2516,499,482,4068, 14.0 , 61.8 , 12.3 , 11.8 ,172.91,5.62,15.1
3206,"Kab. Tasikmalaya, Jawa Barat",Kab,SD,902,4346,878,988,7114, 12.7 , 61.1 , 12.3 , 13.9 ,155.16,5.22,19.9
3273,"Kota Bandung, Jawa Barat",Kota,SD,1980,3753,432,402,6567, 30.2 , 57.1 , 6.6 , 6.1 ,284.94,5.93,12
6303,"Kota Banjar, Jawa Barat",Kota,SD,192,328,95,61,676, 28.4 , 48.5 , 14.1 , 9.0 ,185.57,6.88,14.7
3275,"Kota Bekasi, Jawa Barat",Kota,SD,2738,3521,199,297,6755, 40.5 , 52.1 , 2.9 , 4.4 ,368.76,8.23,20.7
3271,"Kota Bogor, Jawa Barat",Kota,SD,807,1641,115,66,2629, 30.7 , 62.4 , 4.4 , 2.5 ,385.71,8.48,14.3
3277,"Kota Cimahi, Jawa Barat",Kota,SD,539,615,60,45,1259, 42.8 , 48.8 , 4.8 , 3.6 ,419.36,9.52,11.4
3274,"Kota Cirebon, Jawa Barat",Kota,SD,255,788,67,96,1206, 21.1 , 65.3 , 5.6 , 8.0 ,227.45,6.77,12.8
3276,"Kota Depok, Jawa Barat",Kota,SD,1413,2257,127,229,4026, 35.1 , 56.1 , 3.2 , 5.7 ,385.17,7.86,16.9
3272,"Kota Sukabumi, Jawa Barat",Kota,SD,406,667,32,43,1148, 35.4 , 58.1 , 2.8 , 3.7 ,280.85,8.21,11.2
3278,"Kota Tasikmalaya, Jawa Barat",Kota,SD,487,1242,167,103,1999, 24.4 , 62.1 , 8.4 , 5.2 ,281.05,7.78,
3304,"Kab. Banjarnegara, Jawa Tengah",Kab,SD,972,2751,254,207,4184, 23.2 , 65.8 , 6.1 , 4.9 ,118.45,6.11,19.2
3302,"Kab. Banyumas, Jawa Tengah",Kab,SD,1780,3440,334,370,5924, 30.0 , 58.1 , 5.6 , 6.2 ,173.23,6.44,22.4
3325,"Kab. Batang, Jawa Tengah",Kab,SD,662,2037,132,120,2951, 22.4 , 69.0 , 4.5 , 4.1 ,131.07,6.13,13.9
3316,"Kab. Blora, Jawa Tengah",Kab,SD,867,2621,190,245,3923, 22.1 , 66.8 , 4.8 , 6.2 ,121.8,6.06,11.6
3309,"Kab. Boyolali, Jawa Tengah",Kab,SD,845,2676,168,163,3852, 21.9 , 69.5 , 4.4 , 4.2 ,120.86,5.93,15.7
3329,"Kab. Brebes, Jawa Tengah",Kab,SD,1134,3691,515,564,5904, 19.2 , 62.5 , 8.7 , 9.6 ,175.24,5.69,15.9
3301,"Kab. Cilacap, Jawa Tengah",Kab,SD,1091,4543,514,439,6587, 16.6 , 69.0 , 7.8 , 6.7 ,159.46,5.47,14.5
3321,"Kab. Demak, Jawa Tengah",Kab,SD,708,2256,364,474,3802, 18.6 , 59.3 , 9.6 , 12.5 ,191.38,6.51,15
3315,"Kab. Grobogan, Jawa Tengah",Kab,SD,1195,2770,385,866,5216, 22.9 , 53.1 , 7.4 , 16.6 ,156.31,5.24,14.6
3320,"Kab. Jepara, Jawa Tengah",Kab,SD,784,2771,189,132,3876, 20.2 , 71.5 , 4.9 , 3.4 ,149.77,6.04,15.6
3313,"Kab. Karanganyar, Jawa Tengah",Kab,SD,1046,2080,145,82,3353, 31.2 , 62.0 , 4.3 , 2.4 ,141.59,6.39,20.1
3305,"Kab. Kebumen, Jawa Tengah",Kab,SD,1367,3081,372,419,5239, 26.1 , 58.8 , 7.1 , 8.0 ,146.11,5.79,16.2
3324,"Kab. Kendal, Jawa Tengah",Kab,SD,627,2274,432,333,3666, 17.1 , 62.0 , 11.8 , 9.1 ,144.91,5.45,14
3310,"Kab. Klaten, Jawa Tengah",Kab,SD,640,3276,662,578,5156, 12.4 , 63.5 , 12.8 , 11.2 ,130.31,5.89,27
3319,"Kab. Kudus, Jawa Tengah",Kab,SD,770,1719,201,186,2876, 26.8 , 59.8 , 7.0 , 6.5 ,130.88,5.45,15.2
3308,"Kab. Magelang, Jawa Tengah",Kab,SD,1137,2522,349,359,4367, 26.0 , 57.8 , 8.0 , 8.2 ,148.05,6.25,22.6
3318,"Kab. Pati, Jawa Tengah",Kab,SD,888,2450,352,721,4411, 20.1 , 55.5 , 8.0 , 16.3 ,133.49,5.65,15.1
3326,"Kab. Pekalongan, Jawa Tengah",Kab,SD,668,2352,183,153,3356, 19.9 , 70.1 , 5.5 , 4.6 ,143.71,5.69,15.4
3327,"Kab. Pemalang, Jawa Tengah",Kab,SD,966,3269,433,360,5028, 19.2 , 65.0 , 8.6 , 7.2 ,180.62,5.42,19.8
3303,"Kab. Purbalingga, Jawa Tengah",Kab,SD,883,2108,187,180,3358, 26.3 , 62.8 , 5.6 , 5.4 ,163.1,6.77,18.5
3306,"Kab. Purworejo, Jawa Tengah",Kab,SD,937,2050,206,249,3442, 27.2 , 59.6 , 6.0 , 7.2 ,128.48,5.86,7.7
3317,"Kab. Rembang, Jawa Tengah",Kab,SD,523,1672,148,161,2504, 20.9 , 66.8 , 5.9 , 6.4 ,137.51,6.24,16.5
3322,"Kab. Semarang, Jawa Tengah",Kab,SD,1333,1924,136,129,3522, 37.8 , 54.6 , 3.9 , 3.7 ,151.41,6.41,9.7
3314,"Kab. Sragen, Jawa Tengah",Kab,SD,815,2384,258,363,3820, 21.3 , 62.4 , 6.8 , 9.5 ,135.8,5.65,14.2
3311,"Kab. Sukoharjo, Jawa Tengah",Kab,SD,585,2409,169,115,3278, 17.8 , 73.5 , 5.2 , 3.5 ,127.86,6.29,18.5
3328,"Kab. Tegal, Jawa Tengah",Kab,SD,752,3204,483,443,4882, 15.4 , 65.6 , 9.9 , 9.1 ,186.98,5.57,13.6
3323,"Kab. Temanggung, Jawa Tengah",Kab,SD,727,1649,207,293,2876, 25.3 , 57.3 , 7.2 , 10.2 ,137.34,5.99,15.7
3312,"Kab. Wonogiri, Jawa Tengah",Kab,SD,1189,2858,349,510,4906, 24.2 , 58.3 , 7.1 , 10.4 ,99.15,5.41,23.9
3307,"Kab. Wonosobo, Jawa Tengah",Kab,SD,816,2007,208,227,3258, 25.0 , 61.6 , 6.4 , 7.0 ,150.8,6.18,16
3371,"Kota Magelang, Jawa Tengah",Kota,SD,307,237,10,11,565, 54.3 , 41.9 , 1.8 , 1.9 ,195.23,6.69,13.4
3375,"Kota Pekalongan, Jawa Tengah",Kota,SD,251,530,34,32,847, 29.6 , 62.6 , 4.0 , 3.8 ,226.26,8.09,16.7
3373,"Kota Salatiga, Jawa Tengah",Kota,SD,243,395,29,6,673, 36.1 , 58.7 , 4.3 , 0.9 ,178.12,7.08,19.9
3374,"Kota Semarang, Jawa Tengah",Kota,SD,1852,2611,139,129,4731, 39.1 , 55.2 , 2.9 , 2.7 ,274.73,8.43,16.1
3372,"Kota Surakarta, Jawa Tengah",Kota,SD,1167,954,74,161,2356, 49.5 , 40.5 , 3.1 , 6.8 ,251.62,8.04,21.5
3376,"Kota Tegal, Jawa Tengah",Kota,SD,350,541,13,40,944, 37.1 , 57.3 , 1.4 , 4.2 ,182.71,6.37,12.8
3526,"Kab. Bangkalan, Jawa Timur",Kab,SD,553,2414,511,662,4140, 13.4 , 58.3 , 12.3 , 16.0 ,160.6,4.91,12.8
3510,"Kab. Banyuwangi, Jawa Timur",Kab,SD,766,3735,579,698,5778, 13.3 , 64.6 , 10.0 , 12.1 ,149.8,6.25,16
3505,"Kab. Blitar, Jawa Timur",Kab,SD,993,2846,290,430,4559, 21.8 , 62.4 , 6.4 , 9.4 ,113.75,5.94,19.9
3522,"Kab. Bojonegoro, Jawa Timur",Kab,SD,1083,2905,299,454,4741, 22.8 , 61.3 , 6.3 , 9.6 ,106.23,5.27,13.8
3511,"Kab. Bondowoso, Jawa Timur",Kab,SD,711,1923,242,551,3427, 20.7 , 56.1 , 7.1 , 16.1 ,121.04,5.81,13.6
3525,"Kab. Gresik, Jawa Timur",Kab,SD,669,1939,319,498,3425, 19.5 , 56.6 , 9.3 , 14.5 ,172.42,6.48,10.5
3509,"Kab. Jember, Jawa Timur",Kab,SD,2094,4149,551,996,7790, 26.9 , 53.3 , 7.1 , 12.8 ,185.19,6.45,16.4
3517,"Kab. Jombang, Jawa Timur",Kab,SD,1389,1791,180,273,3633, 38.2 , 49.3 , 5.0 , 7.5 ,137.83,6.06,14.8
3506,"Kab. Kediri, Jawa Timur",Kab,SD,1405,2922,292,384,5003, 28.1 , 58.4 , 5.8 , 7.7 ,174.28,6.76,13.2
3524,"Kab. Lamongan, Jawa Timur",Kab,SD,419,2705,504,415,4043, 10.4 , 66.9 , 12.5 , 10.3 ,89.98,5.48,10.8
3508,"Kab. Lumajang, Jawa Timur",Kab,SD,986,2180,241,332,3739, 26.4 , 58.3 , 6.4 , 8.9 ,128.78,5.91,18
3519,"Kab. Madiun, Jawa Timur",Kab,SD,672,1560,203,258,2693, 25.0 , 57.9 , 7.5 , 9.6 ,103.38,5.09,13.1
3520,"Kab. Magetan, Jawa Timur",Kab,SD,477,2148,289,207,3121, 15.3 , 68.8 , 9.3 , 6.6 ,86.92,5.94,17.6
3507,"Kab. Malang, Jawa Timur",Kab,SD,1471,5667,416,358,7912, 18.6 , 71.6 , 5.3 , 4.5 ,159.41,6.21,17.3
3516,"Kab. Mojokerto, Jawa Timur",Kab,SD,581,1981,320,248,3130, 18.6 , 63.3 , 10.2 , 7.9 ,165.43,6.73,12.4
3518,"Kab. Nganjuk, Jawa Timur",Kab,SD,795,2383,389,575,4142, 19.2 , 57.5 , 9.4 , 13.9 ,129.79,5.42,19
3521,"Kab. Ngawi, Jawa Timur",Kab,SD,948,2007,247,271,3473, 27.3 , 57.8 , 7.1 , 7.8 ,106.44,5.79,14.5
3501,"Kab. Pacitan, Jawa Timur",Kab,SD,840,1542,144,91,2617, 32.1 , 58.9 , 5.5 , 3.5 ,94.62,6.06,17.7
3528,"Kab. Pamekasan, Jawa Timur",Kab,SD,504,1850,333,511,3198, 15.8 , 57.8 , 10.4 , 16.0 ,133.23,5.87,15.2
3514,"Kab. Pasuruan, Jawa Timur",Kab,SD,1367,2929,331,383,5010, 27.3 , 58.5 , 6.6 , 7.6 ,175.32,6.55,14.9
3502,"Kab. Ponorogo, Jawa Timur",Kab,SD,780,2617,242,247,3886, 20.1 , 67.3 , 6.2 , 6.4 ,106.14,5.76,14.1
3513,"Kab. Probolinggo, Jawa Timur",Kab,SD,960,2665,250,395,4270, 22.5 , 62.4 , 5.9 , 9.3 ,126.89,5.98,16.4
3527,"Kab. Sampang, Jawa Timur",Kab,SD,631,2208,349,472,3660, 17.2 , 60.3 , 9.5 , 12.9 ,127.39,5.07,11.4
3515,"Kab. Sidoarjo, Jawa Timur",Kab,SD,1643,3052,304,315,5314, 30.9 , 57.4 , 5.7 , 5.9 ,293.6,8.23,19.9
3529,"Kab. Sumenep, Jawa Timur",Kab,SD,619,2119,660,646,4044, 15.3 , 52.4 , 16.3 , 16.0 ,97.07,4.54,13.4
3503,"Kab. Trenggalek, Jawa Timur",Kab,SD,804,1734,181,187,2906, 27.7 , 59.7 , 6.2 , 6.4 ,106.11,5.85,17
3523,"Kab. Tuban, Jawa Timur",Kab,SD,998,2338,226,318,3880, 25.7 , 60.3 , 5.8 , 8.2 ,131.32,5.87,14.4
3504,"Kab. Tulungagung, Jawa Timur",Kab,SD,923,2800,265,278,4266, 21.6 , 65.6 , 6.2 , 6.5 ,124.74,5.88,14.7
3579,"Kota Batu, Jawa Timur",Kota,SD,247,359,6,9,621, 39.8 , 57.8 , 1.0 , 1.4 ,210.46,7.86,9.9
3572,"Kota Blitar, Jawa Timur",Kota,SD,163,378,21,26,588, 27.7 , 64.3 , 3.6 , 4.4 ,250.48,8.94,18.1
3571,"Kota Kediri, Jawa Timur",Kota,SD,295,557,70,78,1000, 29.5 , 55.7 , 7.0 , 7.8 ,214.86,6.43,15.1
3577,"Kota Madiun, Jawa Timur",Kota,SD,283,310,5,28,626, 45.2 , 49.5 , 0.8 , 4.5 ,227.16,8.81,23.1
3573,"Kota Malang, Jawa Timur",Kota,SD,1267,1418,50,33,2768, 45.8 , 51.2 , 1.8 , 1.2 ,281.64,9.54,22.7
3576,"Kota Mojokerto, Jawa Timur",Kota,SD,135,259,15,11,420, 32.1 , 61.7 , 3.6 , 2.6 ,234.23,6.75,13
3575,"Kota Pasuruan, Jawa Timur",Kota,SD,233,482,14,16,745, 31.3 , 64.7 , 1.9 , 2.1 ,298.64,10.88,11.3
3578,"Kota Surabaya, Jawa Timur",Kota,SD,3596,3843,171,334,7944, 45.3 , 48.4 , 2.2 , 4.2 ,348.98,9.11,17.6
6102,"Kab. Bengkayang, Kalimantan Barat",Kab,SD,237,939,246,326,1748, 13.6 , 53.7 , 14.1 , 18.6 ,137.78,5.07,11.7
6108,"Kab. Kapuas Hulu, Kalimantan Barat",Kab,SD,482,1277,303,204,2266, 21.3 , 56.4 , 13.4 , 9.0 ,79.99,4.94,9.9
6111,"Kab. Kayong Utara, Kalimantan Barat",Kab,SD,164,473,44,41,722, 22.7 , 65.5 , 6.1 , 5.7 ,141.73,6.32,12.3
6106,"Kab. Ketapang, Kalimantan Barat",Kab,SD,671,1749,394,367,3181, 21.1 , 55.0 , 12.4 , 11.5 ,124.11,5.07,9.1
6112,"Kab. Kuburaya, Kalimantan Barat",Kab,SD,519,1129,331,464,2443, 21.2 , 46.2 , 13.5 , 19.0 ,154.45,5.72,15.1
6103,"Kab. Landak, Kalimantan Barat",Kab,SD,422,1349,398,454,2623, 16.1 , 51.4 , 15.2 , 17.3 ,108.13,4.57,12.6
6110,"Kab. Melawi, Kalimantan Barat",Kab,SD,164,722,213,339,1438, 11.4 , 50.2 , 14.8 , 23.6 ,102.72,4.69,9.6
6104,"Kab. Mempawah, Kalimantan Barat",Kab,SD,335,688,93,175,1291, 25.9 , 53.3 , 7.2 , 13.6 ,147.14,5.83,12.5
6101,"Kab. Sambas, Kalimantan Barat",Kab,SD,583,1684,308,306,2881, 20.2 , 58.5 , 10.7 , 10.6 ,177.13,5.99,13.1
6109,"Kab. Sekadau, Kalimantan Barat",Kab,SD,400,853,112,87,1452, 27.5 , 58.7 , 7.7 , 6.0 ,111.95,5.47,10.4
6171,"Kota Pontianak, Kalimantan Barat",Kota,SD,802,829,96,75,1802, 44.5 , 46.0 , 5.3 , 4.2 ,407.72,10.64,18.6
6172,"Kota Singkawang, Kalimantan Barat",Kota,SD,412,540,42,50,1044, 39.5 , 51.7 , 4.0 , 4.8 ,278.37,10.55,14.5
6311,"Kab. Balangan, Kalimantan Selatan",Kab,SD,279,742,42,20,1083, 25.8 , 68.5 , 3.9 , 1.8 ,73.34,5.94,12
6303,"Kab. Banjar, Kalimantan Selatan",Kab,SD,498,1382,206,278,2364, 21.1 , 58.5 , 8.7 , 11.8 ,185.57,6.88,14.7
6304,"Kab. Barito Kuala, Kalimantan Selatan",Kab,SD,355,1054,239,144,1792, 19.8 , 58.8 , 13.3 , 8.0 ,110.79,6.13,11.9
6306,"Kab. Hulu Sungai Selatan, Kalimantan Selatan",Kab,SD,473,948,38,68,1527, 31.0 , 62.1 , 2.5 , 4.5 ,82.83,6.09,11.4
6309,"Kab. Tabalong, Kalimantan Selatan",Kab,SD,465,833,116,141,1555, 29.9 , 53.6 , 7.5 , 9.1 ,116.96,6.49,15.8
6310,"Kab. Tanah Bumbu, Kalimantan Selatan",Kab,SD,563,936,64,111,1674, 33.6 , 55.9 , 3.8 , 6.6 ,183.72,7.31,12.8
6301,"Kab. Tanah Laut, Kalimantan Selatan",Kab,SD,323,1033,110,324,1790, 18.0 , 57.7 , 6.1 , 18.1 ,155.05,6.32,14.4
6372,"Kota Banjarbaru, Kalimantan Selatan",Kota,SD,428,497,8,21,954, 44.9 , 52.1 , 0.8 , 2.2 ,311.53,11.04,12.2
6371,"Kota Banjarmasin, Kalimantan Selatan",Kota,SD,844,1172,57,182,2255, 37.4 , 52.0 , 2.5 , 8.1 ,244.34,7.92,19.5
6204,"Kab. Barito Selatan, Kalimantan Tengah",Kab,SD,281,618,96,73,1068, 26.3 , 57.9 , 9.0 , 6.8 ,84.87,5.81,16.5
6212,"Kab. Barito Timur, Kalimantan Tengah",Kab,SD,231,563,65,68,927, 24.9 , 60.7 , 7.0 , 7.3 ,80.58,5.34,9.8
6205,"Kab. Barito Utara, Kalimantan Tengah",Kab,SD,245,659,101,88,1093, 22.4 , 60.3 , 9.2 , 8.1 ,99.64,5.89,13.1
6211,"Kab. Gunung Mas, Kalimantan Tengah",Kab,SD,189,766,69,120,1144, 16.5 , 67.0 , 6.0 , 10.5 ,89.26,5.74,13.4
6203,"Kab. Kapuas, Kalimantan Tengah",Kab,SD,362,1359,254,326,2301, 15.7 , 59.1 , 11.0 , 14.2 ,93.27,5.52,11.8
6209,"Kab. Katingan, Kalimantan Tengah",Kab,SD,517,734,31,35,1317, 39.3 , 55.7 , 2.4 , 2.7 ,104.82,5.89,12.3
6202,"Kab. Kotawaringin Timur, Kalimantan Tengah",Kab,SD,690,1440,223,169,2522, 27.4 , 57.1 , 8.8 , 6.7 ,153.4,6.12,12.9
6207,"Kab. Lamandau, Kalimantan Tengah",Kab,SD,132,458,50,52,692, 19.1 , 66.2 , 7.2 , 7.5 ,87.5,5.45,9.8
6213,"Kab. Murung Raya, Kalimantan Tengah",Kab,SD,287,570,119,95,1071, 26.8 , 53.2 , 11.1 , 8.9 ,94.2,5.31,11.8
6210,"Kab. Pulang Pisau, Kalimantan Tengah",Kab,SD,268,594,105,166,1133, 23.7 , 52.4 , 9.3 , 14.7 ,77.85,5.31,11.4
6208,"Kab. Seruyan, Kalimantan Tengah",Kab,SD,379,699,56,71,1205, 31.5 , 58.0 , 4.6 , 5.9 ,125.13,6.66,9.7
6271,"Kota Palangka Raya, Kalimantan Tengah",Kota,SD,281,671,50,111,1113, 25.2 , 60.3 , 4.5 , 10.0 ,215.6,8.65,12.4
6405,"Kab. Berau, Kalimantan Timur",Kab,SD,433,768,47,29,1277, 33.9 , 60.1 , 3.7 , 2.3 ,176.92,7.07,15.3
6402,"Kab. Kutai Barat, Kalimantan Timur",Kab,SD,498,748,117,53,1416, 35.2 , 52.8 , 8.3 , 3.7 ,97.99,5.86,5.6
6403,"Kab. Kutai Kartanegara, Kalimantan Timur",Kab,SD,1356,2320,217,262,4155, 32.6 , 55.8 , 5.2 , 6.3 ,195.53,8.39,15.1
6404,"Kab. Kutai Timur, Kalimantan Timur",Kab,SD,711,1047,143,96,1997, 35.6 , 52.4 , 7.2 , 4.8 ,215.15,7.91,15.8
6401,"Kab. Paser, Kalimantan Timur",Kab,SD,454,865,68,107,1494, 30.4 , 57.9 , 4.6 , 7.2 ,146.49,6.3,14.4
6409,"Kab. Penajam Paser Utara, Kalimantan Timur",Kab,SD,331,520,41,16,908, 36.5 , 57.3 , 4.5 , 1.8 ,205.22,7.92,15.7
6471,"Kota Balikpapan, Kalimantan Timur",Kota,SD,935,776,9,27,1747, 53.5 , 44.4 , 0.5 , 1.5 ,384.44,8.88,16
6474,"Kota Bontang, Kalimantan Timur",Kota,SD,395,203,11,17,626, 63.1 , 32.4 , 1.8 , 2.7 ,348.75,9.7,14.9
6472,"Kota Samarinda, Kalimantan Timur",Kota,SD,1045,1076,57,87,2265, 46.1 , 47.5 , 2.5 , 3.8 ,405.84,8.78,18
6502,"Kab. Bulungan, Kalimantan Utara",Kab,SD,123,514,100,167,904, 13.6 , 56.9 , 11.1 , 18.5 ,128.71,6.13,16.9
6501,"Kab. Malinau, Kalimantan Utara",Kab,SD,162,449,21,61,693, 23.4 , 64.8 , 3.0 , 8.8 ,102.88,6.29,12.6
6504,"Kab. Nunukan, Kalimantan Utara",Kab,SD,219,649,71,69,1008, 21.7 , 64.4 , 7.0 , 6.8 ,168.64,6.61,13.2
6571,"Kota Tarakan, Kalimantan Utara",Kota,SD,424,252,4,32,712, 59.6 , 35.4 , 0.6 , 4.5 ,434.43,11.2,17.1
2102,"Kab. Bintan, Kepulauan Riau",Kab,SD,152,493,43,79,767, 19.8 , 64.3 , 5.6 , 10.3 ,198.54,7.58,15.3
2101,"Kab. Karimun, Kepulauan Riau",Kab,SD,442,519,73,61,1095, 40.4 , 47.4 , 6.7 , 5.6 ,203.58,7.76,16.7
2171,"Kota Batam, Kepulauan Riau",Kota,SD,1852,1687,105,57,3701, 50.0 , 45.6 , 2.8 , 1.5 ,402.25,9.61,19.8
2172,"Kota Tanjungpinang, Kepulauan Riau",Kota,SD,260,328,23,53,664, 39.2 , 49.4 , 3.5 , 8.0 ,355.25,8.25,13.1
1803,"Kab. Lampung Selatan, Lampung",Kab,SD,892,2135,223,324,3574, 25.0 , 59.7 , 6.2 , 9.1 ,204.85,6.22,11.1
1805,"Kab. Lampung Tengah, Lampung",Kab,SD,1016,3316,510,672,5514, 18.4 , 60.1 , 9.2 , 12.2 ,177.62,6.54,19
1804,"Kab. Lampung Timur, Lampung",Kab,SD,592,2513,518,652,4275, 13.8 , 58.8 , 12.1 , 15.3 ,166.69,6.04,11.8
1806,"Kab. Lampung Utara, Lampung",Kab,SD,324,1657,441,593,3015, 10.7 , 55.0 , 14.6 , 19.7 ,157.35,6.2,20
1810,"Kab. Pringsewu, Lampung",Kab,SD,587,963,132,254,1936, 30.3 , 49.7 , 6.8 , 13.1 ,150.18,6.07,12.9
1802,"Kab. Tanggamus, Lampung",Kab,SD,586,1589,247,390,2812, 20.8 , 56.5 , 8.8 , 13.9 ,146.8,5.58,13.8
1808,"Kab. Tulang Bawang, Lampung",Kab,SD,266,890,210,289,1655, 16.1 , 53.8 , 12.7 , 17.5 ,229.88,6.3,9.6
1807,"Kab. Way Kanan, Lampung",Kab,SD,267,1200,297,526,2290, 11.7 , 52.4 , 13.0 , 23.0 ,162.2,5.09,13.3
1871,"Kota Bandar Lampung, Lampung",Kota,SD,1153,1223,60,100,2536, 45.5 , 48.2 , 2.4 , 3.9 ,387.08,8.64,17.9
1872,"Kota Metro, Lampung",Kota,SD,234,326,32,38,630, 37.1 , 51.7 , 5.1 , 6.0 ,282.63,9.7,12.3
8109,"Kab. Buru Selatan, Maluku",Kab,SD,191,248,25,94,558, 34.2 , 44.4 , 4.5 , 16.8 ,119.28,5.07,10.2
8103,"Kab. Maluku Tengah, Maluku",Kab,SD,492,1679,156,215,2542, 19.4 , 66.1 , 6.1 , 8.5 ,129.85,5.88,15
8102,"Kab. Maluku Tenggara, Maluku",Kab,SD,280,450,70,87,887, 31.6 , 50.7 , 7.9 , 9.8 ,111.44,5.69,0
8101,"Kab. Maluku Tenggara Barat, Maluku",Kab,SD,124,430,85,185,824, 15.0 , 52.2 , 10.3 , 22.5 ,152.3,5.73,0
8106,"Kab. Seram Bagian Barat, Maluku",Kab,SD,287,668,166,253,1374, 20.9 , 48.6 , 12.1 , 18.4 ,134.59,6.21,11.7
8171,"Kota Ambon, Maluku",Kota,SD,242,746,119,119,1226, 19.7 , 60.8 , 9.7 , 9.7 ,190.14,5.75,23.1
8201,"Kab. Halmahera Barat, Maluku Utara",Kab,SD,156,649,127,119,1051, 14.8 , 61.8 , 12.1 , 11.3 ,90.73,4.79,2.2
8204,"Kab. Halmahera Selatan, Maluku Utara",Kab,SD,229,878,172,417,1696, 13.5 , 51.8 , 10.1 , 24.6 ,132.19,4.6,7.6
8202,"Kab. Halmahera Tengah, Maluku Utara",Kab,SD,64,287,51,58,460, 13.9 , 62.4 , 11.1 , 12.6 ,122.69,6.05,8.7
8206,"Kab. Halmahera Timur, Maluku Utara",Kab,SD,87,282,122,132,623, 14.0 , 45.3 , 19.6 , 21.2 ,132.05,4.7,6.8
8205,"Kab. halmahera Utara, Maluku Utara",Kab,SD,244,685,78,214,1221, 20.0 , 56.1 , 6.4 , 17.5 ,121.32,5.05,0.7
8207,"Kab. Kepulauan Morotai, Maluku Utara",Kab,SD,178,203,37,38,456, 39.0 , 44.5 , 8.1 , 8.3 ,118.27,4.81,8
